[
  {
    "id": "bridge.capabilities",
    "version": "1.0",
    "owner": "admin-backoffice-service",
    "source_endpoint": "",
    "bridge_endpoint": "/capabilities",
    "method": "GET",
    "state": "READ_ONLY",
    "permission": "bridge.capabilities.read",
    "scope": "karryam + exact market + exact organization; operation reads additionally staff-bound",
    "risk": "R0",
    "privacy": "MINIMIZED_METADATA",
    "source_version_required": false,
    "idempotency_required": false,
    "approval": "NOT_APPLICABLE_TO_LOCAL_METADATA",
    "evidence": "signed purpose; command reason_code and case_reference where applicable",
    "feature_flag": "ADMIN_REMOTE_ENABLED; domain commands have no enable flag",
    "tests": [
      "TestAuthorizedDiscovery"
    ],
    "blocker": "",
    "fallback": "Fail closed if authentication, authorization, or audit persistence is unavailable."
  },
  {
    "id": "bridge.health",
    "version": "1.0",
    "owner": "admin-backoffice-service",
    "source_endpoint": "",
    "bridge_endpoint": "/health/aggregate",
    "method": "GET",
    "state": "READ_ONLY",
    "permission": "bridge.health.read",
    "scope": "karryam + exact market + exact organization; operation reads additionally staff-bound",
    "risk": "R0",
    "privacy": "MINIMIZED_METADATA",
    "source_version_required": false,
    "idempotency_required": false,
    "approval": "NOT_APPLICABLE_TO_LOCAL_METADATA",
    "evidence": "signed purpose; command reason_code and case_reference where applicable",
    "feature_flag": "ADMIN_REMOTE_ENABLED; domain commands have no enable flag",
    "tests": [
      "TestHealthDegraded"
    ],
    "blocker": "",
    "fallback": "Fail closed if authentication, authorization, or audit persistence is unavailable."
  },
  {
    "id": "overview.read",
    "version": "1.0",
    "owner": "analytics-service",
    "source_endpoint": "",
    "bridge_endpoint": "/overview",
    "method": "GET",
    "state": "BLOCKED_DEPENDENCY",
    "permission": "overview.read",
    "scope": "karryam + exact market + exact organization; operation reads additionally staff-bound",
    "risk": "R0",
    "privacy": "MINIMIZED_METADATA",
    "source_version_required": false,
    "idempotency_required": false,
    "approval": "NOT_APPLICABLE_TO_LOCAL_METADATA",
    "evidence": "signed purpose; command reason_code and case_reference where applicable",
    "feature_flag": "ADMIN_REMOTE_ENABLED; domain commands have no enable flag",
    "tests": [
      "TestDisabledRoutes"
    ],
    "blocker": "Scoped minimized overview owner adapter is not implemented.",
    "fallback": "Use the owning service's existing authorized operational process."
  },
  {
    "id": "search.read",
    "version": "1.0",
    "owner": "multiple-owners",
    "source_endpoint": "",
    "bridge_endpoint": "/search",
    "method": "GET",
    "state": "BLOCKED_DEPENDENCY",
    "permission": "search.read",
    "scope": "karryam + exact market + exact organization; operation reads additionally staff-bound",
    "risk": "R1",
    "privacy": "MINIMIZED_METADATA",
    "source_version_required": false,
    "idempotency_required": false,
    "approval": "NOT_APPLICABLE_TO_LOCAL_METADATA",
    "evidence": "signed purpose; command reason_code and case_reference where applicable",
    "feature_flag": "ADMIN_REMOTE_ENABLED; domain commands have no enable flag",
    "tests": [
      "TestDisabledRoutes"
    ],
    "blocker": "Owner search contracts and privacy filters required.",
    "fallback": "Use the owning service's existing authorized operational process."
  },
  {
    "id": "entities.read",
    "version": "1.0",
    "owner": "entity-owner",
    "source_endpoint": "",
    "bridge_endpoint": "/entities/{type}/{id}",
    "method": "GET",
    "state": "BLOCKED_DEPENDENCY",
    "permission": "entities.read",
    "scope": "karryam + exact market + exact organization; operation reads additionally staff-bound",
    "risk": "R1",
    "privacy": "MINIMIZED_METADATA",
    "source_version_required": false,
    "idempotency_required": false,
    "approval": "NOT_APPLICABLE_TO_LOCAL_METADATA",
    "evidence": "signed purpose; command reason_code and case_reference where applicable",
    "feature_flag": "ADMIN_REMOTE_ENABLED; domain commands have no enable flag",
    "tests": [
      "TestDisabledRoutes"
    ],
    "blocker": "Per-entity owner contract and evidence authorization required.",
    "fallback": "Use the owning service's existing authorized operational process."
  },
  {
    "id": "bridge.operations.read",
    "version": "1.0",
    "owner": "admin-backoffice-service",
    "source_endpoint": "",
    "bridge_endpoint": "/operations/{id}",
    "method": "GET",
    "state": "READ_ONLY",
    "permission": "bridge.operations.read",
    "scope": "karryam + exact market + exact organization; operation reads additionally staff-bound",
    "risk": "R1",
    "privacy": "MINIMIZED_METADATA",
    "source_version_required": false,
    "idempotency_required": false,
    "approval": "NOT_APPLICABLE_TO_LOCAL_METADATA",
    "evidence": "signed purpose; command reason_code and case_reference where applicable",
    "feature_flag": "ADMIN_REMOTE_ENABLED; domain commands have no enable flag",
    "tests": [
      "TestOperationScope"
    ],
    "blocker": "",
    "fallback": "Fail closed if authentication, authorization, or audit persistence is unavailable."
  },
  {
    "id": "bridge.operations.submit",
    "version": "1.0",
    "owner": "command-owner",
    "source_endpoint": "",
    "bridge_endpoint": "/operations",
    "method": "POST",
    "state": "DISABLED",
    "permission": "bridge.operations.submit",
    "scope": "karryam + exact market + exact organization; operation reads additionally staff-bound",
    "risk": "R2",
    "privacy": "MINIMIZED_METADATA",
    "source_version_required": true,
    "idempotency_required": true,
    "approval": "NOT_APPLICABLE_TO_LOCAL_METADATA",
    "evidence": "signed purpose; command reason_code and case_reference where applicable",
    "feature_flag": "ADMIN_REMOTE_ENABLED; domain commands have no enable flag",
    "tests": [
      "TestRejectedSubmission"
    ],
    "blocker": "No domain command is registered. Valid submissions are durably REJECTED; HTTP 503 is not domain success.",
    "fallback": "Use the owning service's existing authorized operational process."
  },
  {
    "id": "operations.cancel",
    "version": "1.0",
    "owner": "command-owner",
    "source_endpoint": "",
    "bridge_endpoint": "/operations/{id}/cancel",
    "method": "POST",
    "state": "DISABLED",
    "permission": "operations.cancel",
    "scope": "karryam + exact market + exact organization; operation reads additionally staff-bound",
    "risk": "R2",
    "privacy": "MINIMIZED_METADATA",
    "source_version_required": true,
    "idempotency_required": true,
    "approval": "NOT_APPLICABLE_TO_LOCAL_METADATA",
    "evidence": "signed purpose; command reason_code and case_reference where applicable",
    "feature_flag": "ADMIN_REMOTE_ENABLED; domain commands have no enable flag",
    "tests": [
      "TestDisabledRoutes"
    ],
    "blocker": "Owner-specific cancellation safety contract required.",
    "fallback": "Use the owning service's existing authorized operational process."
  },
  {
    "id": "support.cases.read",
    "version": "1.0",
    "owner": "support-dispute-service",
    "source_endpoint": "",
    "bridge_endpoint": "/support/cases",
    "method": "GET",
    "state": "BLOCKED_DEPENDENCY",
    "permission": "support.cases.read",
    "scope": "karryam + exact market + exact organization; operation reads additionally staff-bound",
    "risk": "R1",
    "privacy": "MINIMIZED_METADATA",
    "source_version_required": false,
    "idempotency_required": false,
    "approval": "NOT_APPLICABLE_TO_LOCAL_METADATA",
    "evidence": "signed purpose; command reason_code and case_reference where applicable",
    "feature_flag": "ADMIN_REMOTE_ENABLED; domain commands have no enable flag",
    "tests": [
      "TestDisabledRoutes"
    ],
    "blocker": "Scoped minimized support adapter and evidence permissions required.",
    "fallback": "Use the owning service's existing authorized operational process."
  },
  {
    "id": "finance.summary.read",
    "version": "1.0",
    "owner": "payment-wallet-service",
    "source_endpoint": "",
    "bridge_endpoint": "/finance/summary",
    "method": "GET",
    "state": "BLOCKED_DEPENDENCY",
    "permission": "finance.summary.read",
    "scope": "karryam + exact market + exact organization; operation reads additionally staff-bound",
    "risk": "R1",
    "privacy": "MINIMIZED_METADATA",
    "source_version_required": false,
    "idempotency_required": false,
    "approval": "NOT_APPLICABLE_TO_LOCAL_METADATA",
    "evidence": "signed purpose; command reason_code and case_reference where applicable",
    "feature_flag": "ADMIN_REMOTE_ENABLED; domain commands have no enable flag",
    "tests": [
      "TestDisabledRoutes"
    ],
    "blocker": "Wallet-owned scoped finance summary contract required.",
    "fallback": "Use the owning service's existing authorized operational process."
  },
  {
    "id": "verification.cases.read",
    "version": "1.0",
    "owner": "verification-compliance-service",
    "source_endpoint": "",
    "bridge_endpoint": "/verification/cases",
    "method": "GET",
    "state": "BLOCKED_DEPENDENCY",
    "permission": "verification.cases.read",
    "scope": "karryam + exact market + exact organization; operation reads additionally staff-bound",
    "risk": "R1",
    "privacy": "MINIMIZED_METADATA",
    "source_version_required": false,
    "idempotency_required": false,
    "approval": "NOT_APPLICABLE_TO_LOCAL_METADATA",
    "evidence": "signed purpose; command reason_code and case_reference where applicable",
    "feature_flag": "ADMIN_REMOTE_ENABLED; domain commands have no enable flag",
    "tests": [
      "TestDisabledRoutes"
    ],